<!-- 编辑使用 XMLSpy v2006 U (http://www.altova.com) 由 any (any) -->
<!-- 编辑使用 XMLSpy v2006 U (http://www.altova.com) 由 any (any) -->
<!-- 编辑使用 XMLSpy v2006 U (http://www.altova.com) 由 any (any) -->
<ICDData xmlns:xsi="http://www.w3.org/2001/XMLSchema-instance" xsi:noNamespaceSchemaLocation="IcdSchema.xsd">
	<Name/>
	<Data>
		<Item>
			<Offset>0</Offset>
			<StartBit>0</StartBit>
			<BitWidth>32</BitWidth>
			<Type>dword</Type>
			<Name>ISI-01#A429_OUT(162) 接收数据</Name>
			<Description>接收的32位数据</Description>
			<GroupName>ISI-01#A429_IN(162)</GroupName>
			<IsScaled>0</IsScaled>
			<Childs>
				<Item>
					<Offset>0</Offset>
					<StartBit>0</StartBit>
					<BitWidth>8</BitWidth>
					<Type>byte</Type>
					<Name>ISI-01#A429_OUT(162) LABEL</Name>
					<Description>8bit有效,八进制,162</Description>
					<GroupName>ISI-01#A429_IN(162)</GroupName>
					<IsScaled>0</IsScaled>
					<SystemName>Arinc429</SystemName>
					<Tag>40</Tag>
					<ValueTextList>114</ValueTextList>
					<LinkTo>\6272T_00\ch0</LinkTo>
				</Item>
				<Item>
					<Offset>1</Offset>
					<StartBit>0</StartBit>
					<BitWidth>4</BitWidth>
					<Type>byte</Type>
					<Name>ISI-01#A429_OUT(162) re1</Name>
					<Description>4bit</Description>
					<IsScaled>0</IsScaled>
					<Tag>0</Tag>
					<ValueTextList>0</ValueTextList>
					<LinkTo>\6272T_00\ch0</LinkTo>
				</Item>
				<Item>
					<Offset>1</Offset>
					<StartBit>4</StartBit>
					<BitWidth>17</BitWidth>
					<Type>int</Type>
					<Name>ISI-01#A429_OUT(162) FIX_Distance</Name>
					<Description>17bit有效,范围:0~6553.5</Description>
					<GroupName>ISI-01#A429_IN(162)</GroupName>
					<IsScaled>1</IsScaled>
					<ScaleA>0.1</ScaleA>
					<SystemName>Arinc429</SystemName>
					<Unit>NM</Unit>
					<Tag>0</Tag>
					<ValueTextList>0</ValueTextList>
					<LinkTo>\6272T_00\ch0</LinkTo>
				</Item>
				<Item>
					<Offset>3</Offset>
					<StartBit>5</StartBit>
					<BitWidth>2</BitWidth>
					<Type>byte</Type>
					<Name>ISI-01#A429_OUT(162) SSM</Name>
					<Description>2bit有效</Description>
					<GroupName>ISI-01#A429_IN(162)</GroupName>
					<IsScaled>0</IsScaled>
					<SystemName>Arinc429</SystemName>
					<Tag>0</Tag>
					<ValueTextList>0</ValueTextList>
					<LinkTo>\6272T_00\ch0</LinkTo>
				</Item>
				<Item>
					<Offset>3</Offset>
					<StartBit>7</StartBit>
					<BitWidth>1</BitWidth>
					<Type>byte</Type>
					<Name>ISI-01#A429_OUT(162) PARITY</Name>
					<Description>1bit有效</Description>
					<GroupName>ISI-01#A429_IN(162)</GroupName>
					<IsScaled>0</IsScaled>
					<SystemName>Arinc429</SystemName>
					<Tag>0</Tag>
					<ValueTextList>0</ValueTextList>
					<LinkTo>\6272T_00\ch0</LinkTo>
				</Item>
			</Childs>
			<SystemName>Arinc429</SystemName>
		</Item>
	</Data>
</ICDData>
