<?xml version="1.0" encoding="utf-8"?>
<!-- 编辑使用 XMLSpy v2006 U (http://www.altova.com) 由 any (any) -->
<!-- 编辑使用 XMLSpy v2006 U (http://www.altova.com) 由 any (any) -->
<ICDData xmlns:xsi="http://www.w3.org/2001/XMLSchema-instance" xsi:noNamespaceSchemaLocation="IcdSchema.xsd">
	<Name/>
	<Data>
		<Item>
			<Offset>0</Offset>
			<StartBit>0</StartBit>
			<BitWidth>32</BitWidth>
			<Type>dword</Type>
			<Name>ISI-01#A429_OUT(331) 接收数据</Name>
			<Description>接收的32位数据</Description>
			<GroupName>ISI-01#A429_OUT(331)</GroupName>
			<IsScaled>0</IsScaled>
			<Childs>
				<Item>
					<Offset>0</Offset>
					<StartBit>0</StartBit>
					<BitWidth>8</BitWidth>
					<Type>byte</Type>
					<Name>ISI-01#A429_OUT(331) LABEL</Name>
					<Description>8bit有效,八进制,331</Description>
					<GroupName>ISI-01#A429_OUT(331)</GroupName>
					<IsScaled>0</IsScaled>
					<SystemName>Arinc429</SystemName>
					<Tag>40</Tag>
					<ValueTextList>217</ValueTextList>
					<LinkTo>5272_00\ch0</LinkTo>
				</Item>
				<Item>
					<Offset>1</Offset>
					<StartBit>0</StartBit>
					<BitWidth>2</BitWidth>
					<Type>byte</Type>
					<Name>ISI-01#A429_OUT(331) SDI</Name>
					<Description>2bit有效,内容:ISIS=0</Description>
					<GroupName>ISI-01#A429_OUT(331)</GroupName>
					<IsScaled>0</IsScaled>
					<SystemName>Arinc429</SystemName>
					<Tag>0</Tag>
					<ValueTextList>ISIS=0</ValueTextList>
					<LinkTo>5272_00\ch0</LinkTo>
				</Item>
				<Item>
					<Offset>1</Offset>
					<StartBit>2</StartBit>
					<BitWidth>3</BitWidth>
					<Type>byte</Type>
					<Name>ISI-01#A429_OUT(331) PAD</Name>
					<Description>3bit有效</Description>
					<GroupName>ISI-01#A429_OUT(331)</GroupName>
					<IsScaled>0</IsScaled>
					<SystemName>Arinc429</SystemName>
					<Tag>0</Tag>
					<ValueTextList>0</ValueTextList>
					<LinkTo>5272_00\ch0</LinkTo>
				</Item>
				<Item>
					<Offset>1</Offset>
					<StartBit>5</StartBit>
					<BitWidth>16</BitWidth>
					<Type>int</Type>
					<Name>ISI-01#A429_OUT(331) Longitudinal_Accel</Name>
					<Description>16bit有效,范围:-20~19.99941832</Description>
					<GroupName>ISI-01#A429_OUT(331)</GroupName>
					<IsScaled>1</IsScaled>
					<ScaleA>0.000610352</ScaleA>
					<SystemName>Arinc429</SystemName>
					<Min>0</Min>
					<Max>0</Max>
					<Unit>G</Unit>
					<Tag>0</Tag>
					<ValueTextList>0</ValueTextList>
					<LinkTo>5272_00\ch0</LinkTo>
				</Item>
				<Item>
					<Offset>3</Offset>
					<StartBit>5</StartBit>
					<BitWidth>2</BitWidth>
					<Type>byte</Type>
					<Name>ISI-01#A429_OUT(331) SSM</Name>
					<Description>2bit有效,内容:Not_Used1=0,Not_Used2=1,Not_Used3=2,Normal_Operation=3</Description>
					<GroupName>ISI-01#A429_OUT(331)</GroupName>
					<IsScaled>0</IsScaled>
					<SystemName>Arinc429</SystemName>
					<Tag>0</Tag>
					<ValueTextList>Not_Used1=0,Not_Used2=1,Not_Used3=2,Normal_Operation=3</ValueTextList>
					<LinkTo>5272_00\ch0</LinkTo>
				</Item>
				<Item>
					<Offset>3</Offset>
					<StartBit>7</StartBit>
					<BitWidth>1</BitWidth>
					<Type>byte</Type>
					<Name>ISI-01#A429_OUT(331) PARITY</Name>
					<Description>1bit有效</Description>
					<GroupName>ISI-01#A429_OUT(331)</GroupName>
					<IsScaled>0</IsScaled>
					<SystemName>Arinc429</SystemName>
					<Tag>0</Tag>
					<ValueTextList>0</ValueTextList>
					<LinkTo>5272_00\ch0</LinkTo>
				</Item>
			</Childs>
			<SystemName>Arinc429</SystemName>
		</Item>
	</Data>
</ICDData>
