<?xml version="1.0" encoding="UTF-8"?>
<!-- 编辑使用 XMLSpy v2006 U (http://www.altova.com) 由 any (any) -->
<!-- 编辑使用 XMLSpy v2006 U (http://www.altova.com) 由 any (any) -->
<!-- 编辑使用 XMLSpy v2006 U (http://www.altova.com) 由 any (any) -->
<!-- 编辑使用 XMLSpy v2006 U (http://www.altova.com) 由 any (any) -->
<!-- 编辑使用 XMLSpy v2006 U (http://www.altova.com) 由 any (any) -->
<!-- 编辑使用 XMLSpy v2006 U (http://www.altova.com) 由 any (any) -->
<ICDData xmlns:xsi="http://www.w3.org/2001/XMLSchema-instance" xsi:noNamespaceSchemaLocation="IcdSchema.xsd">
	<Name/>
	<Data>
		<Item>
			<Offset>0</Offset>
			<StartBit>0</StartBit>
			<BitWidth>8</BitWidth>
			<Type>byte</Type>
			<Name>byte0</Name>
			<Description>默认为1</Description>
			<IsScaled>0</IsScaled>
			<Tag>40</Tag>
			<ValueTextList>1</ValueTextList>
			<LinkTo>\ComCHH50W_COM11\ch11</LinkTo>
		</Item>
		<Item>
			<Offset>1</Offset>
			<StartBit>0</StartBit>
			<BitWidth>8</BitWidth>
			<Type>byte</Type>
			<Name>byte1</Name>
			<Description>默认为3</Description>
			<IsScaled>0</IsScaled>
			<Tag>40</Tag>
			<ValueTextList>3</ValueTextList>
			<LinkTo>\ComCHH50W_COM11\ch11</LinkTo>
		</Item>
		<Item>
			<Offset>2</Offset>
			<StartBit>0</StartBit>
			<BitWidth>8</BitWidth>
			<Type>byte</Type>
			<Name>byte2</Name>
			<Description>默认为0x4</Description>
			<IsScaled>0</IsScaled>
			<Tag>40</Tag>
			<ValueTextList>4</ValueTextList>
			<LinkTo>\ComCHH50W_COM11\ch11</LinkTo>
		</Item>
		<Item>
			<Offset>3</Offset>
			<StartBit>0</StartBit>
			<BitWidth>16</BitWidth>
			<Type>word</Type>
			<Name>5V导光板电源 获取电压设定值</Name>
			<Description>仅此项是大端，单位为V，分辨率为0.01</Description>
			<GroupName>5V导光板电源</GroupName>
			<IsScaled>1</IsScaled>
			<ScaleA>0.01</ScaleA>
			<SystemName>5V导光板电源</SystemName>
			<Unit>V</Unit>
			<Tag>41</Tag>
			<ValueTextList>0</ValueTextList>
			<LinkTo>\ComCHH50W_COM11\ch11</LinkTo>
		</Item>
		<Item>
			<Offset>5</Offset>
			<StartBit>0</StartBit>
			<BitWidth>16</BitWidth>
			<Type>word</Type>
			<Name>5V导光板电源 获取电流设定值</Name>
			<Description>仅此项是大端，单位为A，分辨率为0.01</Description>
			<GroupName>5V导光板电源</GroupName>
			<IsScaled>1</IsScaled>
			<ScaleA>0.01</ScaleA>
			<SystemName>5V导光板电源</SystemName>
			<Unit>A</Unit>
			<Tag>41</Tag>
			<ValueTextList>0</ValueTextList>
			<LinkTo>\ComCHH50W_COM11\ch11</LinkTo>
		</Item>
		<Item>
			<Offset>7</Offset>
			<StartBit>0</StartBit>
			<BitWidth>16</BitWidth>
			<Type>word</Type>
			<Name>CRC校验</Name>
			<Description>crc校验，小端</Description>
			<IsScaled>0</IsScaled>
			<Tag>0</Tag>
			<ValueTextList>0</ValueTextList>
			<LinkTo>\ComCHH50W_COM11\ch11</LinkTo>
		</Item>
	</Data>
</ICDData>
