<!-- 编辑使用 XMLSpy v2006 U (http://www.altova.com) 由 any (any) -->
<!-- 编辑使用 XMLSpy v2006 U (http://www.altova.com) 由 any (any) -->
<!-- 编辑使用 XMLSpy v2006 U (http://www.altova.com) 由 any (any) -->
<!-- 编辑使用 XMLSpy v2006 U (http://www.altova.com) 由 any (any) -->
<!-- 编辑使用 XMLSpy v2006 U (http://www.altova.com) 由 any (any) -->
<ICDData xmlns:xsi="http://www.w3.org/2001/XMLSchema-instance" xsi:noNamespaceSchemaLocation="IcdSchema.xsd">
	<Name/>
	<Data>
		<Item>
			<Offset>0</Offset>
			<StartBit>0</StartBit>
			<BitWidth>32</BitWidth>
			<Type>dword</Type>
			<Name>ISI-01#A429_IN1(111) 发送数据</Name>
			<Description>发送的32位数据</Description>
			<GroupName>ISI-01#A429_IN1(111)</GroupName>
			<IsScaled>0</IsScaled>
			<Childs>
				<Item>
					<Offset>0</Offset>
					<StartBit>0</StartBit>
					<BitWidth>8</BitWidth>
					<Type>byte</Type>
					<Name>ISI-01#A429_IN1(111) LABEL</Name>
					<Description>8bit有效,八进制,111</Description>
					<GroupName>ISI-01#A429_IN1(111)</GroupName>
					<IsScaled>0</IsScaled>
					<SystemName>Arinc429</SystemName>
					<Tag>40</Tag>
					<ValueTextList>73</ValueTextList>
					<LinkTo>5272_00\ch0</LinkTo>
				</Item>
				<Item>
					<Offset>1</Offset>
					<StartBit>0</StartBit>
					<BitWidth>21</BitWidth>
					<Type>int</Type>
					<Name>ISI-01#A429_IN1(111) GNSS_Longitude</Name>
					<Description>21bit有效,范围:-180~179.9998283</Description>
					<GroupName>ISI-01#A429_IN1(111)</GroupName>
					<IsScaled>1</IsScaled>
					<ScaleA>0.000171661376953125</ScaleA>
					<SystemName>Arinc429</SystemName>
					<Unit>°</Unit>
					<Tag>0</Tag>
					<ValueTextList>0</ValueTextList>
					<LinkTo>5272_00\ch0</LinkTo>
				</Item>
				<Item>
					<Offset>3</Offset>
					<StartBit>5</StartBit>
					<BitWidth>2</BitWidth>
					<Type>byte</Type>
					<Name>ISI-01#A429_IN1(111) SSM</Name>
					<Description>2bit有效,内容:Failure_Warning=0,No_Computed_Data=1,Functional_Test=2,Normal_Operation=3</Description>
					<GroupName>ISI-01#A429_IN1(111)</GroupName>
					<IsScaled>0</IsScaled>
					<SystemName>Arinc429</SystemName>
					<Tag>0</Tag>
					<ValueTextList>Failure_Warning=0,No_Computed_Data=1,Functional_Test=2,Normal_Operation=3</ValueTextList>
					<LinkTo>5272_00\ch0</LinkTo>
				</Item>
				<Item>
					<Offset>3</Offset>
					<StartBit>7</StartBit>
					<BitWidth>1</BitWidth>
					<Type>byte</Type>
					<Name>ISI-01#A429_IN1(111) PARITY</Name>
					<Description>1bit有效,Set to obtain odd word parity</Description>
					<GroupName>ISI-01#A429_IN1(111)</GroupName>
					<IsScaled>0</IsScaled>
					<SystemName>Arinc429</SystemName>
					<Tag>0</Tag>
					<ValueTextList>0</ValueTextList>
					<LinkTo>5272_00\ch0</LinkTo>
				</Item>
			</Childs>
			<SystemName>Arinc429</SystemName>
		</Item>
	</Data>
</ICDData>
