<!-- 编辑使用 XMLSpy v2006 U (http://www.altova.com) 由 any (any) -->
<!-- 编辑使用 XMLSpy v2006 U (http://www.altova.com) 由 any (any) -->
<!-- 编辑使用 XMLSpy v2006 U (http://www.altova.com) 由 any (any) -->
<!-- 编辑使用 XMLSpy v2006 U (http://www.altova.com) 由 any (any) -->
<!-- 编辑使用 XMLSpy v2006 U (http://www.altova.com) 由 any (any) -->
<!-- 编辑使用 XMLSpy v2006 U (http://www.altova.com) 由 any (any) -->
<!-- 编辑使用 XMLSpy v2006 U (http://www.altova.com) 由 any (any) -->
<!-- 编辑使用 XMLSpy v2006 U (http://www.altova.com) 由 any (any) -->
<!-- 编辑使用 XMLSpy v2006 U (http://www.altova.com) 由 any (any) -->
<!-- 编辑使用 XMLSpy v2006 U (http://www.altova.com) 由 any (any) -->
<<<<<<< HEAD
<!-- 编辑使用 XMLSpy v2006 U (http://www.altova.com) 由 any (any) -->
=======
>>>>>>> 65a49280ce73fa5643f132301f9d69071d289295
<ICDData xmlns:xsi="http://www.w3.org/2001/XMLSchema-instance" xsi:noNamespaceSchemaLocation="IcdSchema.xsd">
	<Name/>
	<Data>
		<Item>
			<Offset>0</Offset>
			<StartBit>0</StartBit>
			<BitWidth>32</BitWidth>
			<Type>dword</Type>
			<Name>ISI-01#A429_IN4(273) 发送数据</Name>
			<Description>发送的32位数据</Description>
			<GroupName>ISI-01#A429_IN4(273)</GroupName>
			<IsScaled>0</IsScaled>
			<Childs>
				<Item>
					<Offset>0</Offset>
					<StartBit>0</StartBit>
					<BitWidth>8</BitWidth>
					<Type>byte</Type>
					<Name>ISI-01#A429_IN4(273) LABEL</Name>
					<Description>8bit有效,八进制,273</Description>
					<GroupName>ISI-01#A429_IN4(273)</GroupName>
					<IsScaled>0</IsScaled>
					<SystemName>Arinc429</SystemName>
					<Tag>40</Tag>
					<ValueTextList>187</ValueTextList>
					<LinkTo>5272_03\ch3</LinkTo>
				</Item>
				<Item>
					<Offset>1</Offset>
					<StartBit>0</StartBit>
					<BitWidth>2</BitWidth>
					<Type>byte</Type>
					<Name>ISI-01#A429_IN4(273) SDI</Name>
					<Description>2bit有效,SOURCE/Destination Identifier</Description>
					<GroupName>ISI-01#A429_IN4(273)</GroupName>
					<IsScaled>0</IsScaled>
					<SystemName>Arinc429</SystemName>
					<Tag>0</Tag>
					<ValueTextList>0</ValueTextList>
					<LinkTo>5272_03\ch3</LinkTo>
				</Item>
				<Item>
					<Offset>1</Offset>
					<StartBit>2</StartBit>
					<BitWidth>19</BitWidth>
					<Type>int</Type>
					<Name>ISI-01#A429_IN4(273) NLG_Dnlocked</Name>
					<Description>19bit有效</Description>
					<GroupName>ISI-01#A429_IN4(273)</GroupName>
					<IsScaled>0</IsScaled>
					<SystemName>Arinc429</SystemName>
					<Min>-262144</Min>
					<Max>262143</Max>
					<Tag>0</Tag>
					<ValueTextList>0</ValueTextList>
					<LinkTo>5272_03\ch3</LinkTo>
				</Item>
				<Item>
					<Offset>3</Offset>
					<StartBit>5</StartBit>
					<BitWidth>2</BitWidth>
					<Type>byte</Type>
					<Name>ISI-01#A429_IN4(273) SSM</Name>
					<Description>2bit有效,Sign/Status Matrix</Description>
					<GroupName>ISI-01#A429_IN4(273)</GroupName>
					<IsScaled>0</IsScaled>
					<SystemName>Arinc429</SystemName>
					<Tag>0</Tag>
					<ValueTextList>0</ValueTextList>
					<LinkTo>5272_03\ch3</LinkTo>
				</Item>
				<Item>
					<Offset>3</Offset>
					<StartBit>7</StartBit>
					<BitWidth>1</BitWidth>
					<Type>byte</Type>
					<Name>ISI-01#A429_IN4(273) Parity</Name>
					<Description>1bit有效,Set to obtain odd word parity</Description>
					<GroupName>ISI-01#A429_IN4(273)</GroupName>
					<IsScaled>0</IsScaled>
					<SystemName>Arinc429</SystemName>
					<Tag>0</Tag>
					<ValueTextList>0</ValueTextList>
					<LinkTo>5272_03\ch3</LinkTo>
				</Item>
			</Childs>
			<SystemName>Arinc429</SystemName>
		</Item>
	</Data>
</ICDData>
