<!-- 编辑使用 XMLSpy v2006 U (http://www.altova.com) 由 any (any) -->
<!-- 编辑使用 XMLSpy v2006 U (http://www.altova.com) 由 any (any) -->
<ICDData xmlns:xsi="http://www.w3.org/2001/XMLSchema-instance" xsi:noNamespaceSchemaLocation="IcdSchema.xsd">
	<Name/>
	<Data>
		<Item>
			<Offset>0</Offset>
			<StartBit>0</StartBit>
			<BitWidth>32</BitWidth>
			<Type>dword</Type>
			<Name>ISI-01#A429_OUT(260) 接收数据</Name>
			<Description>接收的32位数据</Description>
			<GroupName>ISI-01#A429_IN(260)</GroupName>
			<IsScaled>0</IsScaled>
			<Childs>
				<Item>
					<Offset>0</Offset>
					<StartBit>0</StartBit>
					<BitWidth>8</BitWidth>
					<Type>byte</Type>
					<Name>ISI-01#A429_OUT(260) LABEL</Name>
					<Description>8bit有效,八进制,260</Description>
					<GroupName>ISI-01#A429_IN(260)</GroupName>
					<IsScaled>0</IsScaled>
					<SystemName>Arinc429</SystemName>
					<Tag>40</Tag>
					<ValueTextList>176</ValueTextList>
					<LinkTo>\6272T_00\ch0</LinkTo>
				</Item>
				<Item>
					<Offset>1</Offset>
					<StartBit>0</StartBit>
					<BitWidth>2</BitWidth>
					<Type>byte</Type>
					<Name>ISI-01#A429_OUT(260) SDI</Name>
					<Description>2bit有效,内容:Not_Used=0,Left_GNSS=1,Right_GNSS=2,Not_Used=3</Description>
					<GroupName>ISI-01#A429_IN(260)</GroupName>
					<IsScaled>0</IsScaled>
					<SystemName>Arinc429</SystemName>
					<Tag>0</Tag>
					<ValueTextList>Not_Used1=0,Left_GNSS=1,Right_GNSS=2,Not_Used2=3</ValueTextList>
					<LinkTo>\6272T_00\ch0</LinkTo>
				</Item>
				<Item>
					<Offset>1</Offset>
					<StartBit>2</StartBit>
					<BitWidth>4</BitWidth>
					<Type>byte</Type>
					<Name>ISI-01#A429_OUT(260) Date_Year_Ones_Digit</Name>
					<Description>4bit有效</Description>
					<GroupName>ISI-01#A429_IN(260)</GroupName>
					<IsScaled>0</IsScaled>
					<SystemName>Arinc429</SystemName>
					<Tag>0</Tag>
					<ValueTextList>0</ValueTextList>
					<LinkTo>\6272T_00\ch0</LinkTo>
				</Item>
				<Item>
					<Offset>1</Offset>
					<StartBit>6</StartBit>
					<BitWidth>4</BitWidth>
					<Type>byte</Type>
					<Name>ISI-01#A429_OUT(260) Date_Year_Tens_Digit</Name>
					<Description>4bit有效</Description>
					<GroupName>ISI-01#A429_IN(260)</GroupName>
					<IsScaled>0</IsScaled>
					<SystemName>Arinc429</SystemName>
					<Tag>0</Tag>
					<ValueTextList>0</ValueTextList>
					<LinkTo>\6272T_00\ch0</LinkTo>
				</Item>
				<Item>
					<Offset>2</Offset>
					<StartBit>2</StartBit>
					<BitWidth>4</BitWidth>
					<Type>byte</Type>
					<Name>ISI-01#A429_OUT(260) Month_Ones_Digit</Name>
					<Description>4bit有效</Description>
					<GroupName>ISI-01#A429_IN(260)</GroupName>
					<IsScaled>0</IsScaled>
					<SystemName>Arinc429</SystemName>
					<Tag>0</Tag>
					<ValueTextList>0</ValueTextList>
					<LinkTo>\6272T_00\ch0</LinkTo>
				</Item>
				<Item>
					<Offset>2</Offset>
					<StartBit>6</StartBit>
					<BitWidth>1</BitWidth>
					<Type>byte</Type>
					<Name>ISI-01#A429_OUT(260) Month_Tens_Digit</Name>
					<Description>1bit有效</Description>
					<GroupName>ISI-01#A429_IN(260)</GroupName>
					<IsScaled>0</IsScaled>
					<SystemName>Arinc429</SystemName>
					<Tag>0</Tag>
					<ValueTextList>0</ValueTextList>
					<LinkTo>\6272T_00\ch0</LinkTo>
				</Item>
				<Item>
					<Offset>2</Offset>
					<StartBit>7</StartBit>
					<BitWidth>4</BitWidth>
					<Type>byte</Type>
					<Name>ISI-01#A429_OUT(260) Day_Ones_Digit</Name>
					<Description>4bit有效</Description>
					<GroupName>ISI-01#A429_IN(260)</GroupName>
					<IsScaled>0</IsScaled>
					<SystemName>Arinc429</SystemName>
					<Tag>0</Tag>
					<ValueTextList>0</ValueTextList>
					<LinkTo>\6272T_00\ch0</LinkTo>
				</Item>
				<Item>
					<Offset>3</Offset>
					<StartBit>3</StartBit>
					<BitWidth>2</BitWidth>
					<Type>byte</Type>
					<Name>ISI-01#A429_OUT(260) Day_Tens_Digit</Name>
					<Description>2bit有效</Description>
					<GroupName>ISI-01#A429_IN(260)</GroupName>
					<IsScaled>0</IsScaled>
					<SystemName>Arinc429</SystemName>
					<Tag>0</Tag>
					<ValueTextList>0</ValueTextList>
					<LinkTo>\6272T_00\ch0</LinkTo>
				</Item>
				<Item>
					<Offset>3</Offset>
					<StartBit>5</StartBit>
					<BitWidth>2</BitWidth>
					<Type>byte</Type>
					<Name>ISI-01#A429_OUT(260) SSM</Name>
					<Description>2bit有效</Description>
					<GroupName>ISI-01#A429_IN(260)</GroupName>
					<IsScaled>0</IsScaled>
					<SystemName>Arinc429</SystemName>
					<Tag>0</Tag>
					<ValueTextList>0</ValueTextList>
					<LinkTo>\6272T_00\ch0</LinkTo>
				</Item>
				<Item>
					<Offset>3</Offset>
					<StartBit>7</StartBit>
					<BitWidth>1</BitWidth>
					<Type>byte</Type>
					<Name>ISI-01#A429_OUT(260) PARITY</Name>
					<Description>1bit有效</Description>
					<GroupName>ISI-01#A429_IN(260)</GroupName>
					<IsScaled>0</IsScaled>
					<SystemName>Arinc429</SystemName>
					<Tag>0</Tag>
					<ValueTextList>0</ValueTextList>
					<LinkTo>\6272T_00\ch0</LinkTo>
				</Item>
			</Childs>
			<SystemName>Arinc429</SystemName>
		</Item>
	</Data>
</ICDData>
