<?xml version="1.0" encoding="UTF-8"?>
<!-- 编辑使用 XMLSpy v2006 U (http://www.altova.com) 由 any (any) -->
<!-- 编辑使用 XMLSpy v2006 U (http://www.altova.com) 由 any (any) -->
<!-- 编辑使用 XMLSpy v2006 U (http://www.altova.com) 由 any (any) -->
<!-- 编辑使用 XMLSpy v2006 U (http://www.altova.com) 由 any (any) -->
<!-- 编辑使用 XMLSpy v2006 U (http://www.altova.com) 由 any (any) -->
<ICDData xmlns:xsi="http://www.w3.org/2001/XMLSchema-instance" xsi:noNamespaceSchemaLocation="IcdSchema.xsd">
	<Name/>
	<Data>
		<Item>
			<Offset>0</Offset>
			<StartBit>0</StartBit>
			<BitWidth>32</BitWidth>
			<Type>dword</Type>
			<Name>电源输出控制</Name>
			<Description>电源输出控制</Description>
			<IsScaled>0</IsScaled>
			<Childs>
				<Item>
					<Offset>0</Offset>
					<StartBit>0</StartBit>
					<BitWidth>2</BitWidth>
					<Type>dword</Type>
					<Name>28V1：输出使能</Name>
					<Description>28V1：输出使能</Description>
					<IsScaled>0</IsScaled>
					<SystemName>电源供电模块</SystemName>
					<ValueTextList>闭合=3,断开=0</ValueTextList>
				</Item>
				<Item>
					<Offset>0</Offset>
					<StartBit>2</StartBit>
					<BitWidth>2</BitWidth>
					<Type>dword</Type>
					<Name>28V2：输出使能</Name>
					<Description>28V2：输出使能</Description>
					<IsScaled>0</IsScaled>
					<SystemName>电源供电模块</SystemName>
					<ValueTextList>闭合=3,断开=0</ValueTextList>
				</Item>
				<Item>
					<Offset>0</Offset>
					<StartBit>4</StartBit>
					<BitWidth>2</BitWidth>
					<Type>dword</Type>
					<Name>5V1：输出使能</Name>
					<Description>5V1：输出使能</Description>
					<IsScaled>0</IsScaled>
					<SystemName>电源供电模块</SystemName>
					<ValueTextList>闭合=3,断开=0</ValueTextList>
				</Item>
				<Item>
					<Offset>0</Offset>
					<StartBit>6</StartBit>
					<BitWidth>2</BitWidth>
					<Type>dword</Type>
					<Name>5V2：输出使能</Name>
					<Description>5V2：输出使能</Description>
					<IsScaled>0</IsScaled>
					<SystemName>电源供电模块</SystemName>
					<ValueTextList>闭合=3,断开=0</ValueTextList>
				</Item>
				<Item>
					<Offset>1</Offset>
					<StartBit>0</StartBit>
					<BitWidth>2</BitWidth>
					<Type>dword</Type>
					<Name>+15V1：输出使能</Name>
					<Description>+15V1：输出使能</Description>
					<IsScaled>0</IsScaled>
					<SystemName>电源供电模块</SystemName>
					<ValueTextList>闭合=3,断开=0</ValueTextList>
				</Item>
				<Item>
					<Offset>1</Offset>
					<StartBit>2</StartBit>
					<BitWidth>2</BitWidth>
					<Type>dword</Type>
					<Name>15V2：输出使能</Name>
					<Description>15V2：输出使能</Description>
					<IsScaled>0</IsScaled>
					<SystemName>电源供电模块</SystemName>
					<ValueTextList>闭合=3,断开=0</ValueTextList>
				</Item>
				<Item>
					<Offset>1</Offset>
					<StartBit>4</StartBit>
					<BitWidth>2</BitWidth>
					<Type>dword</Type>
					<Name>-15V1：输出使能</Name>
					<Description>-15V1：输出使能</Description>
					<IsScaled>0</IsScaled>
					<SystemName>电源供电模块</SystemName>
					<ValueTextList>闭合=3,断开=0</ValueTextList>
				</Item>
				<Item>
					<Offset>1</Offset>
					<StartBit>6</StartBit>
					<BitWidth>2</BitWidth>
					<Type>dword</Type>
					<Name>BRAKE1</Name>
					<Description>电子负载1-1</Description>
					<IsScaled>0</IsScaled>
					<SystemName>制动器电磁阀模块</SystemName>
					<ValueTextList>闭合=3,断开=0</ValueTextList>
				</Item>
				<Item>
					<Offset>2</Offset>
					<StartBit>0</StartBit>
					<BitWidth>2</BitWidth>
					<Type>dword</Type>
					<Name>BRAKE2</Name>
					<Description>电子负载1-1</Description>
					<IsScaled>0</IsScaled>
					<SystemName>制动器电磁阀模块</SystemName>
					<ValueTextList>闭合=3,断开=0</ValueTextList>
				</Item>
				<Item>
					<Offset>2</Offset>
					<StartBit>2</StartBit>
					<BitWidth>2</BitWidth>
					<Type>dword</Type>
					<Name>BRAKE3</Name>
					<Description>电子负载2-1</Description>
					<IsScaled>0</IsScaled>
					<SystemName>制动器电磁阀模块</SystemName>
					<ValueTextList>闭合=3,断开=0</ValueTextList>
				</Item>
				<Item>
					<Offset>2</Offset>
					<StartBit>4</StartBit>
					<BitWidth>2</BitWidth>
					<Type>dword</Type>
					<Name>BRAKE4</Name>
					<Description>电子负载2-1</Description>
					<IsScaled>0</IsScaled>
					<SystemName>制动器电磁阀模块</SystemName>
					<ValueTextList>闭合=3,断开=0</ValueTextList>
				</Item>
			</Childs>
			<LinkTo>\10AIO2\ch0</LinkTo>
		</Item>
	</Data>
</ICDData>
