<?xml version="1.0" encoding="utf-8"?>
<ICDData xmlns:xsi="http://www.w3.org/2001/XMLSchema-instance" xsi:noNamespaceSchemaLocation="IcdSchema.xsd">
  <Name />
  <Data>
    <Item>
      <Offset>0</Offset>
      <StartBit>0</StartBit>
      <BitWidth>32</BitWidth>
      <Type>float</Type>
      <Name>示波器 CH1-信号测量上升时间</Name>
      <Description>单位为s</Description>
      <GroupName>CH1</GroupName>
      <IsScaled>0</IsScaled>
      <SystemName>示波器</SystemName>
      <Unit>S</Unit>
      <Tag>0</Tag>
      <LinkTo>\UsbDP07504_0\ch0</LinkTo>
    </Item>
    <Item>
      <Offset>4</Offset>
      <StartBit>0</StartBit>
      <BitWidth>32</BitWidth>
      <Type>float</Type>
      <Name>示波器 CH1-信号测量下降时间</Name>
      <Description>单位为s</Description>
      <GroupName>CH1</GroupName>
      <IsScaled>0</IsScaled>
      <SystemName>示波器</SystemName>
      <Unit>S</Unit>
      <Tag>0</Tag>
      <LinkTo>\UsbDP07504_0\ch0</LinkTo>
    </Item>
    <Item>
      <Offset>8</Offset>
      <StartBit>0</StartBit>
      <BitWidth>32</BitWidth>
      <Type>float</Type>
      <Name>示波器 CH1-信号测量过冲</Name>
      <Description>单位为s</Description>
      <GroupName>CH1</GroupName>
      <IsScaled>0</IsScaled>
      <SystemName>示波器</SystemName>
      <Unit>S</Unit>
      <Tag>0</Tag>
      <LinkTo>\UsbDP07504_0\ch0</LinkTo>
    </Item>
    <Item>
      <Offset>12</Offset>
      <StartBit>0</StartBit>
      <BitWidth>32</BitWidth>
      <Type>float</Type>
      <Name>示波器 CH1-信号测量下降沿过冲</Name>
      <Description>单位为s</Description>
      <GroupName>CH1</GroupName>
      <IsScaled>0</IsScaled>
      <SystemName>示波器</SystemName>
      <Unit>S</Unit>
      <Tag>0</Tag>
      <LinkTo>\UsbDP07504_0\ch0</LinkTo>
    </Item>
    <Item>
      <Offset>16</Offset>
      <StartBit>0</StartBit>
      <BitWidth>32</BitWidth>
      <Type>float</Type>
      <Name>示波器 CH1-信号测量峰峰值</Name>
      <Description>单位为V</Description>
      <GroupName>CH1</GroupName>
      <IsScaled>0</IsScaled>
      <SystemName>示波器</SystemName>
      <Unit>V</Unit>
      <Tag>0</Tag>
      <LinkTo>\UsbDP07504_0\ch0</LinkTo>
    </Item>
  </Data>
</ICDData>