<?xml version="1.0" encoding="utf-8"?>
<ICDData xmlns:xsi="http://www.w3.org/2001/XMLSchema-instance" xsi:noNamespaceSchemaLocation="IcdSchema.xsd">
  <Name />
  <Data>
    <Item>
      <Offset>0</Offset>
      <StartBit>0</StartBit>
      <BitWidth>32</BitWidth>
      <Type>dword</Type>
      <Name>ISI-01#直流电源 过流保护功能开关</Name>
      <Description>打开或关闭过流保护功能，参数范围为 ON|OFF。</Description>
      <GroupName>直流电源1</GroupName>
      <IsScaled>0</IsScaled>
      <SystemName>直流电源1</SystemName>
      <Tag>0</Tag>
      <ValueTextList>OFF=0,ON=1</ValueTextList>
      <LinkTo>\ComPower_COM1\ch1</LinkTo>
    </Item>
  </Data>
</ICDData>